{
  "schema_version": 1,
  "action": "send",
  "account": "synthetic-workspace",
  "target": "synthetic-channel",
  "approved_content_sha256": "70897f952b0da3847a6657f3655efb7c7fb3a9cc3af29baa1851dc2f9a7cceba",
  "approved_at": "2026-09-30T16:00:00Z",
  "source_revision": "synthetic-revision-1",
  "result": "not-run",
  "returned_id": null,
  "verified_at": null
}
